{
  "_meta": {
    "schema_version": "esa-compose-v1.0",
    "monitor_slug": "european-strategic-autonomy",
    "composed_at": "2026-05-14T13:24:31.042743+00:00",
    "composed_from": "esa-interpret-v1.0",
    "composed_from_file": "interpret-latest.json",
    "compose_model": "sonar-pro",
    "cycle_disposition": "material_change",
    "composer_flags": [],
    "composer_error": false,
    "composer_error_reason": null,
    "reviewed_by": {
      "verdict": "publish",
      "reviewer_model": "sonar-pro",
      "reviewed_at": "2026-05-14T13:23:48.907904+00:00",
      "review_schema_version": "aim-review-v1.0"
    }
  },
  "weekly_brief_draft": "A",
  "claim_trace": [],
  "_raw_fallback": "{\"_meta\":{\"schema_version\":\"esa-compose-v1.0\",\"monitor_slug\":\"european-strategic-autonomy\",\"composed_at\":null,\"composed_from\":\"esa-interpret-v1.0\",\"composed_from_file\":\"interpret-latest.json\",\"compose_model\":\"claude-sonnet-4-5\",\"cycle_disposition\":\"material_change\",\"composer_flags\":[],\"compose_erroor\":false,\"compose_erroor_reason\":null},\"weekly_brief_draft\":\"A\",\"claim_trace\":[]}\n"
}